{
  "at": "20260815T000000Z",
  "events": [
    {
      "at": "20260815T000000Z",
      "candidate": "x:2087082954543567075",
      "event_id": "bb28ea8ec4614bb7a4f1e613e501479064bca76ea41cfbb838f27d3d28622aa3",
      "payload": {
        "native_id": "2087082954543567075",
        "observation": {
          "createdAt": "2026-08-15",
          "display_line": "- 2026-08-15 [@clowncardwallet post (text available during approved intake)](https://x.com/clowncardwallet/status/2087082954543567075) (X @clowncardwallet)",
          "foundAt": "2026-08-15",
          "label": "X @clowncardwallet",
          "observation_id": "556f8867a60fe599ea2441b656834c5c66da6b916d3f37d9605e229f570c4664",
          "platform": "x",
          "priority": "operator",
          "title": "@clowncardwallet post (text available during approved intake)",
          "url": "https://x.com/clowncardwallet/status/2087082954543567075"
        },
        "platform": "x",
        "state": "pending",
        "url": "https://x.com/clowncardwallet/status/2087082954543567075"
      },
      "type": "observation"
    },
    {
      "at": "20260815T000000Z",
      "candidate": "x:2087259118205554812",
      "event_id": "29e138db9d684da4b8ce2330cd898d90e4e354e1644f8bbbb04691efef998145",
      "payload": {
        "native_id": "2087259118205554812",
        "observation": {
          "createdAt": "2026-08-15",
          "display_line": "- 2026-08-15 [@olvelez007 post (text available during approved intake)](https://x.com/olvelez007/status/2087259118205554812) (X @olvelez007)",
          "foundAt": "2026-08-15",
          "label": "X @olvelez007",
          "observation_id": "0b9c6a1865f236b1548212a64b5102a6940b9638df087496b873922a14cfc063",
          "platform": "x",
          "priority": "operator",
          "title": "@olvelez007 post (text available during approved intake)",
          "url": "https://x.com/olvelez007/status/2087259118205554812"
        },
        "platform": "x",
        "state": "pending",
        "url": "https://x.com/olvelez007/status/2087259118205554812"
      },
      "type": "observation"
    },
    {
      "at": "20260815T000000Z",
      "candidate": "x:2087227666986332257",
      "event_id": "b49a2eda1d6ceffa506477e4f1d05be94705753afdb49078a6c3a7281a9b22d3",
      "payload": {
        "native_id": "2087227666986332257",
        "observation": {
          "createdAt": "2026-08-15",
          "display_line": "- 2026-08-15 [@laurentmt post (text available during approved intake)](https://x.com/laurentmt/status/2087227666986332257) (X @laurentmt)",
          "foundAt": "2026-08-15",
          "label": "X @laurentmt",
          "observation_id": "e36e200def5b29d9bc9f62b8ff2ccafa3f2a70fa8d58b6b181dc04bdd70eaf0e",
          "platform": "x",
          "priority": "operator",
          "title": "@laurentmt post (text available during approved intake)",
          "url": "https://x.com/laurentmt/status/2087227666986332257"
        },
        "platform": "x",
        "state": "pending",
        "url": "https://x.com/laurentmt/status/2087227666986332257"
      },
      "type": "observation"
    },
    {
      "at": "20260815T000000Z",
      "candidate": "x:2087368242666815700",
      "event_id": "5751893ce5f01d1d75f05b5ef90093349306a68a4087182a86693df4b1900dd7",
      "payload": {
        "native_id": "2087368242666815700",
        "observation": {
          "createdAt": "2026-08-15",
          "display_line": "- 2026-08-15 [@charlosrossi post (text available during approved intake)](https://x.com/charlosrossi/status/2087368242666815700) (X @charlosrossi)",
          "foundAt": "2026-08-15",
          "label": "X @charlosrossi",
          "observation_id": "54257fb2d2794ef474f75e5e9f7e5f262574258736553898ffe23b61ef2699b3",
          "platform": "x",
          "priority": "operator",
          "title": "@charlosrossi post (text available during approved intake)",
          "url": "https://x.com/charlosrossi/status/2087368242666815700"
        },
        "platform": "x",
        "state": "pending",
        "url": "https://x.com/charlosrossi/status/2087368242666815700"
      },
      "type": "observation"
    },
    {
      "at": "20260815T000000Z",
      "candidate": "x:2087506473123217436",
      "event_id": "7131c62d2fb91eee1381ff432d926b9b9597083ae52ead0a56e71b14a4196471",
      "payload": {
        "native_id": "2087506473123217436",
        "observation": {
          "createdAt": "2026-08-15",
          "display_line": "- 2026-08-15 [@coletu post (text available during approved intake)](https://x.com/coletu/status/2087506473123217436) (X @coletu)",
          "foundAt": "2026-08-15",
          "label": "X @coletu",
          "observation_id": "ef1fb56f0a150448e512e8884286bdfe4617fc406fd798f2389319d74aad4408",
          "platform": "x",
          "priority": "operator",
          "title": "@coletu post (text available during approved intake)",
          "url": "https://x.com/coletu/status/2087506473123217436"
        },
        "platform": "x",
        "state": "pending",
        "url": "https://x.com/coletu/status/2087506473123217436"
      },
      "type": "observation"
    },
    {
      "at": "20260815T000000Z",
      "candidate": "x:2087504087436705805",
      "event_id": "d3f43106c7ae70559bba7bde49e428e6e5627dc43f988e976d25fb956712ab9c",
      "payload": {
        "native_id": "2087504087436705805",
        "observation": {
          "createdAt": "2026-08-15",
          "display_line": "- 2026-08-15 [@coletu post (text available during approved intake)](https://x.com/coletu/status/2087504087436705805) (X @coletu)",
          "foundAt": "2026-08-15",
          "label": "X @coletu",
          "observation_id": "2e67a02c468ee6492bc770c1f2807572daf58645d6ec92bc1cf3a6e51c6d2bc4",
          "platform": "x",
          "priority": "operator",
          "title": "@coletu post (text available during approved intake)",
          "url": "https://x.com/coletu/status/2087504087436705805"
        },
        "platform": "x",
        "state": "pending",
        "url": "https://x.com/coletu/status/2087504087436705805"
      },
      "type": "observation"
    },
    {
      "at": "20260815T000000Z",
      "candidate": "x:2087226789122732059",
      "event_id": "390997c3011a69bc878097ce6b6901135dae6d823584990eb5b3fbb1764e2546",
      "payload": {
        "native_id": "2087226789122732059",
        "observation": {
          "createdAt": "2026-08-15",
          "display_line": "- 2026-08-15 [@intangiblecoins post (text available during approved intake)](https://x.com/intangiblecoins/status/2087226789122732059) (X @intangiblecoins)",
          "foundAt": "2026-08-15",
          "label": "X @intangiblecoins",
          "observation_id": "4a3eee4c27b67a09dd11b50b90dfbeb46db483b4b645b1bdd338bd88258b779a",
          "platform": "x",
          "priority": "operator",
          "title": "@intangiblecoins post (text available during approved intake)",
          "url": "https://x.com/intangiblecoins/status/2087226789122732059"
        },
        "platform": "x",
        "state": "pending",
        "url": "https://x.com/intangiblecoins/status/2087226789122732059"
      },
      "type": "observation"
    },
    {
      "at": "20260815T000000Z",
      "candidate": "x:2087683189489779164",
      "event_id": "830e7990bedac3c76467cfc4d0b12eef2fcda5371b164246268b72406f318838",
      "payload": {
        "native_id": "2087683189489779164",
        "observation": {
          "createdAt": "2026-08-15",
          "display_line": "- 2026-08-15 [@jamesob post (text available during approved intake)](https://x.com/jamesob/status/2087683189489779164) (X @jamesob)",
          "foundAt": "2026-08-15",
          "label": "X @jamesob",
          "observation_id": "16f5ab7ed1aeade1758e042caaede5191e155352c79a653acb3277cc5c4eb3e3",
          "platform": "x",
          "priority": "operator",
          "title": "@jamesob post (text available during approved intake)",
          "url": "https://x.com/jamesob/status/2087683189489779164"
        },
        "platform": "x",
        "state": "pending",
        "url": "https://x.com/jamesob/status/2087683189489779164"
      },
      "type": "observation"
    },
    {
      "at": "20260815T000000Z",
      "candidate": "x:2087519797042888704",
      "event_id": "e7ecb7f0a4d05b22da8e868a14c09313155f5c001abf22a9423c8485247e13cc",
      "payload": {
        "native_id": "2087519797042888704",
        "observation": {
          "createdAt": "2026-08-15",
          "display_line": "- 2026-08-15 [@bitdov post (text available during approved intake)](https://x.com/bitdov/status/2087519797042888704) (X @bitdov)",
          "foundAt": "2026-08-15",
          "label": "X @bitdov",
          "observation_id": "582d2672141e23b335fd43ac29cefdb4502aac74307da70fb2baa940488d277e",
          "platform": "x",
          "priority": "operator",
          "title": "@bitdov post (text available during approved intake)",
          "url": "https://x.com/bitdov/status/2087519797042888704"
        },
        "platform": "x",
        "state": "pending",
        "url": "https://x.com/bitdov/status/2087519797042888704"
      },
      "type": "observation"
    },
    {
      "at": "20260815T000000Z",
      "candidate": "x:2087962868217966833",
      "event_id": "563cd25f5d3d71e6dbcbd42397eb96003e88c8791722287c1d6810176fc085e4",
      "payload": {
        "native_id": "2087962868217966833",
        "observation": {
          "createdAt": "2026-08-15",
          "display_line": "- 2026-08-15 [@orangesurfbtc post (text available during approved intake)](https://x.com/orangesurfbtc/status/2087962868217966833) (X @orangesurfbtc)",
          "foundAt": "2026-08-15",
          "label": "X @orangesurfbtc",
          "observation_id": "06d0726fcbc395dc527b9202f9b84b7e88496630b3b66aa1d6c1519ff3f4d984",
          "platform": "x",
          "priority": "operator",
          "title": "@orangesurfbtc post (text available during approved intake)",